,Username,Datetime,Text
2134,CNN,2020-12-10 12:45:07+00:00,"Starbucks is betting that by flooding the market with new types of stores, including smaller locations and ones with drive-thru and curbside pickup, it will be able to steal more customers from the competition. https://t.co/LuXT799W5t"
2135,CNN,2020-12-10 07:38:05+00:00,"Starbucks says it plans to increase its store count to about 55,000 by 2030, up from roughly 33,000 today https://t.co/j31Byv6Aey"
2136,CNN,2020-12-01 18:10:02+00:00,Health care workers are getting a special treat from Starbucks this month https://t.co/OEQWZlhGtt
2137,CNN,2020-11-14 21:30:10+00:00,McDonald's and Wendy's seem to be winning while Starbucks and Taco Bell are on the losing end of breakfast according to a recent string of earnings https://t.co/UG343KudCc
2138,CNN,2020-10-30 02:16:25+00:00,"In the United States and the Americas, Starbucks expects same-store sales to jump between 17% and 22% next year. Internationally, the company is expecting a 25% to 30% spike.

The numbers would be a sharp turnaround. https://t.co/K45aH3x1UK"
2139,CNN,2020-10-26 02:00:07+00:00,"A White female customer was caught on video shouting a string of obscenities at a Black Starbucks barista in Southern California, after the customer refused to properly wear a face covering inside the store. https://t.co/u2Pywk4iI0"
2140,CNN,2020-10-25 02:00:12+00:00,"A White female customer was caught on video shouting a string of obscenities at a Black Starbucks barista in Southern California, after the customer refused to properly wear a face covering inside the store. https://t.co/AfXWBC7ckT"
2141,CNN,2020-10-22 10:16:03+00:00,"A White female customer was caught on video shouting a string of obscenities at a Black Starbucks barista in Southern California, after the customer refused to properly wear a face covering inside the store. https://t.co/2ST6GAeuX7"
2142,CNN,2020-10-22 02:45:06+00:00,"A White female customer was caught on video shouting a string of obscenities at a Black Starbucks barista in Southern California, after the customer refused to properly wear a face covering inside the store https://t.co/wHvPPi3vWe"
2143,CNN,2020-07-30 10:22:02+00:00,"A ""furry cloth substance"" found in the Starbucks coffee of an off-duty Los Angeles police officer last month was not a tampon, authorities said. https://t.co/4u7n0nnx6g"
2144,CNN,2020-07-30 07:11:03+00:00,"A ""furry cloth substance"" found in the Starbucks coffee of an off-duty Los Angeles police officer last month was not a tampon, authorities said. https://t.co/8yXtCd0KKw"
2145,CNN,2020-07-28 21:50:31+00:00,"Even as stores began to reopen, the coronavirus pandemic has continued to weigh heavily on sales at Starbucks https://t.co/ARleDYJBmZ"
2146,CNN,2020-07-22 10:41:06+00:00,A former New Jersey Starbucks employee has been arrested after allegedly spitting in the drinks of law enforcement officers https://t.co/mc36eLRDRB
2147,CNN,2020-07-21 15:45:08+00:00,"This fall, you'll be able to pay for Starbucks drinks on your app using -- get this -- a credit card, Apple Pay, Google Pay or even cash. And yes, you'll still be able to collect stars for rewards. https://t.co/hw0gwMKfkv"
2148,CNN,2020-07-13 08:00:09+00:00,"A Muslim woman has filed a discrimination charge against Target after she said she received a drink from a Target Starbucks barista with ""ISIS"" written on the cup instead of her name https://t.co/VtsTvFbMoj"
2149,CNN,2020-07-12 04:29:06+00:00,"A Muslim woman has filed a discrimination charge against Target after she said she received a drink from a Target Starbucks barista with ""ISIS"" written on the cup instead of her name https://t.co/jl4bPoTAlX"
2150,CNN,2020-07-11 11:31:06+00:00,"A Muslim woman has filed a discrimination charge against Target after she said she received a drink from a Target Starbucks barista with ""ISIS"" written on the cup instead of her name https://t.co/N16U69n3P0"
2151,CNN,2020-07-10 05:01:07+00:00,"Starbucks will start requiring customers to wear facial coverings or masks in all 9,000 of its company-owned American stores beginning July 15 https://t.co/2O2KwpRV4I"
2152,CNN,2020-07-08 15:50:02+00:00,"A Muslim woman has filed a discrimination charge against Target after she said she received a drink from a Target Starbucks barista with ""ISIS"" written on the cup instead of her name https://t.co/dkA4DPgQlF"
2153,CNN,2020-07-08 06:01:05+00:00,"A Muslim woman has filed a discrimination charge against Target after she said she received a drink from a Target Starbucks barista with ""ISIS"" written on the cup instead of her name https://t.co/Mhc8eNr9xj"
2154,CNN,2020-07-07 23:59:17+00:00,"A Muslim woman has filed a discrimination charge against Target after she said she received a drink from a Target Starbucks barista with ""ISIS"" written on the cup instead of her name https://t.co/p1FLBifCxR"
2155,CNN,2020-07-03 06:56:00+00:00,"A Starbucks barista who was publicly shamed by a customer after asking her to wear a face mask has received more than $100,000 in virtual tips after a Facebook post that criticized him went viral. https://t.co/GzXqnH2OR9 https://t.co/8ivbCzmqmV"
2156,CNN,2020-07-02 00:04:34+00:00,"Of the 25 largest spenders on Facebook ads last year, only three companies — Microsoft, Starbucks and Pfizer — have publicly confirmed their plans to pause marketing on Facebook. https://t.co/Ymew5nsdt3"
2157,CNN,2020-07-01 07:16:09+00:00,A Starbucks barista who was publicly shamed by a customer after asking her to wear a face mask has received tens of thousands of dollars in virtual tips after a Facebook post that criticized him went viral. https://t.co/t54gxmDD64 https://t.co/1qWh8WBIGQ
2158,CNN,2020-06-30 07:42:36+00:00,A Starbucks barista who was publicly shamed by a customer after asking her to wear a face mask has received tens of thousands of dollars in virtual tips after a Facebook post that criticized him went viral. https://t.co/iUAYtoUQDU https://t.co/fplzlU0LrL
2159,CNN,2020-06-29 18:00:09+00:00,"Shares of Facebook fell nearly 3% in early trading Monday, before rebounding, after brands like Starbucks, Coca-Cola and Hershey's said they'd pause spending on the social media platform over concerns about its handling of misinformation and hate speech. https://t.co/iVGkxnM2Of"
2160,CNN,2020-06-29 11:37:02+00:00,"A Starbucks barista who was publicly shamed by a customer after asking her to wear a face mask has received nearly $80,000 in virtual tips after a Facebook post that criticized him went viral. https://t.co/jSpGHpLiqL"
2161,CNN,2020-06-28 22:15:03+00:00,"A Starbucks barista who was publicly shamed by a customer after asking her to wear a face mask has received nearly $80,000 in virtual tips after a Facebook post that criticized him went viral https://t.co/JNvyx00YAY"
2162,CNN,2020-06-26 19:11:02+00:00,"China's Luckin Coffee had hopes of being as successful with American investors as its rival Starbucks. But following an accounting scandal, Luckin is now heading to Wall Street's graveyard. https://t.co/Ss7arbY44L"
2163,CNN,2020-06-13 03:13:14+00:00,"Catch up on today's business news:

📈 US stocks rebound after the biggest selloff since March

💰 Millennials working from home may be moving the market

📋 Starbucks reverses its stance and will now let baristas wear ""Black Lives Matter"" apparel

https://t.co/gPwg8IPuPN"
2164,CNN,2020-06-12 14:19:54+00:00,"Update: Starbucks is reversing its position that had prohibited employees from wearing paraphernalia, such as T-shirts or pins, supporting the “Black Lives Matter” movement. https://t.co/Y67RQJHRX3"
2165,CNN,2020-06-12 13:10:03+00:00,"Although Starbucks publicly supports Black Lives Matter on its social media channels and in a press release, an internal memo to employees obtained by BuzzFeed News explains that the company won't let baristas do the same. https://t.co/2a4bWYZ7dZ"
2166,CNN,2020-06-11 04:22:05+00:00,"Catch up on business news:

➡️ Sean Hannity's remarks on Fox

➡️ Strategist: 'The stock market has decoupled from Trump'

➡️ Businesses get behind Black Lives Matter

➡️ CrossFit founder Greg Glassman's comments

➡️ Starbucks' strategy shift

https://t.co/pYXPCLTSsS"
2167,CNN,2020-06-10 20:20:01+00:00,"Starbucks says it plans to close up to 400 stores in the US and Canada over the next 18 months, while at the same time adding carryout and pick-up only locations — a strategy shift that illustrates how much consumer behavior has changed during the pandemic https://t.co/69vdlULwIL"
2168,CNN,2020-05-13 04:46:05+00:00,Luckin Coffee fired its CEO after the Chinese homegrown rival to Starbucks was found to have fabricated sales https://t.co/5invI9J1E2
2169,CNN,2020-04-24 01:09:26+00:00,"""This is an emergency, a crisis like no other,"" says former Starbucks CEO Howard Schultz on the impact of coronavirus on small businesses.

""The most humane thing to do by the government is to save them because they deserve it,"" he adds. https://t.co/8vlCGyV9T6 https://t.co/WyiMaJsL6f"
2170,CNN,2020-04-21 11:02:22+00:00,"Starbucks is teaming up with oat milk maker Oatly and plant-based protein companies Beyond Meat and Omnipork in mainland China, offering more options free of meat or animal products. https://t.co/DfOJhC7DXR"
2171,CNN,2020-04-12 07:46:06+00:00,This cooped-up California family built a miniature version of Starbucks and Target in their home https://t.co/EL9522yhiV https://t.co/Vs3O6GBBXv
2172,CNN,2020-03-26 06:46:03+00:00,Frontline workers in the health care industry who are responding to the coronavirus pandemic can get a free tall brewed or iced coffee at Starbucks https://t.co/QeQSk6iPHT
2173,CNN,2020-03-25 21:25:15+00:00,Frontline workers in the health care industry who are responding to the coronavirus pandemic can get a free tall brewed or iced coffee at Starbucks https://t.co/m5WZGBuIsu
2174,CNN,2020-03-21 15:23:59+00:00,"Starbucks has closed its cafes in the United States and Canada for two weeks because of the spread of coronavirus, reducing services to drive-thru and delivery only https://t.co/zU13qSBjZX"
2175,CNN,2020-03-10 12:07:04+00:00,"Starbucks has started trialing a new recyclable and compostable cup in some locations in New York, San Fancisco, Seattle, London and Vancouver https://t.co/RirQ1zzlNR"
2176,CNN,2020-03-10 03:17:06+00:00,"Starbucks has started trialing a new recyclable and compostable cup in some locations in New York, San Fancisco, Seattle, London and Vancouver https://t.co/USSdVs09Ci"
2177,CNN,2020-03-08 11:46:02+00:00,Starbucks has announced it is temporarily suspending the use of personal cups and tumblers at its stores to help prevent the spread of coronavirus https://t.co/ikHCUTJZmR
2178,CNN,2020-03-08 05:01:05+00:00,"In an effort to prevent coronavirus spreading, Starbucks is no longer allowing you to use personal mugs (don't worry, you'll still get your discount) https://t.co/1m7y8IeZoQ"
2179,CNN,2020-03-08 01:00:06+00:00,"A Starbucks employee in downtown Seattle tested positive for the coronavirus, leading to the store's closure for a deep cleaning, the company said https://t.co/iTUgi92q2H"
2180,CNN,2020-03-07 18:33:03+00:00,"A Starbucks employee in downtown Seattle tested positive for the coronavirus, leading to the store's closure for a deep cleaning, the company said https://t.co/GTywXT1zQK"
2181,CNN,2020-03-07 12:16:05+00:00,Starbucks has announced it is temporarily suspending the use of personal cups and tumblers at its stores to help prevent the spread of coronavirus https://t.co/np6pMxldcQ
2182,CNN,2020-03-05 23:46:05+00:00,"Starbucks is expecting significantly lower sales in its Chinese stores in the second quarter because of coronavirus. Now, it estimates a 50% decline, and a hit of between $400 million to $430 million to its revenue in China vs. earlier expectations. https://t.co/bv4Z07uBTH"
2183,CNN,2020-03-05 14:36:12+00:00,"In an effort to prevent coronavirus spreading, Starbucks is no longer allowing you to use personal mugs (don't worry, you'll still get your discount) https://t.co/Xqq9aC0EH2"
2184,CNN,2020-03-05 09:53:29+00:00,"In an effort to prevent coronavirus spreading, Starbucks is no longer allowing you to use personal mugs (don't worry, you'll still get your discount) https://t.co/a4bfc4cFmb"
2185,CNN,2020-03-05 07:08:04+00:00,Starbucks has announced it is temporarily suspending the use of personal cups and tumblers at its stores to help prevent the spread of coronavirus. https://t.co/z3ohMZMPxL
2186,CNN,2020-03-05 05:31:03+00:00,Starbucks has announced it is temporarily suspending the use of personal cups and tumblers at its stores to help prevent the spread of coronavirus https://t.co/NQebLYx9dB
2187,CNN,2020-03-05 00:50:05+00:00,Starbucks has announced it is temporarily suspending the use of personal cups and tumblers at its stores to help prevent the spread of coronavirus https://t.co/H7ygmieuy8
2188,CNN,2020-01-29 07:47:37+00:00,"Starbucks has closed more than half of its roughly 4,300 Chinese stores, as the deadly coronavirus continues to spread in the country https://t.co/vACSQPe8AH"
2189,CNN,2020-01-28 23:12:58+00:00,"Starbucks has closed more than half of its roughly 4,300 Chinese stores, as the deadly coronavirus continues to spread in the country https://t.co/3ZvyPG1dCJ"
2190,CNN,2020-01-17 07:33:11+00:00,"Part of a Starbucks location in McHenry, Illinois, collapsed after a pickup truck crashed into the building https://t.co/IjNRbTGimA"
2191,CNN,2020-01-17 03:46:02+00:00,"Part of a Starbucks location in McHenry, Illinois, collapsed after a pickup truck crashed into the building https://t.co/OvRAKHH166"
2192,CNN,2020-01-07 11:40:05+00:00,"Starting today, about 1,300 Starbucks cafes in Illinois, Indiana, Iowa, Michigan, Minnesota, Missouri and Wisconsin are serving a new oat milk honey latte. https://t.co/OQBJGE4ey6"
2193,CNN,2019-12-15 14:02:07+00:00,Starbucks is apologizing after a California sheriff's office said two of their deputies were ignored in a store. https://t.co/J8QehYrIQt
2194,CNN,2019-12-03 11:41:44+00:00,"The new drink is Irish Cream Cold Brew, which is Starbucks' cold brew coffee mixed with Irish Cream syrup and topped with vanilla sweet cream cold foam and cocoa powder. It goes on sale Tuesday across US stores and will be available for a limited time. https://t.co/52icZwDrcR"
2195,CNN,2019-11-30 23:15:05+00:00,"A Starbucks employee who gave a police officer cups of coffee with the word ""PIG"" printed on the label has been fired, the company said. https://t.co/36B70iqkOW"
2196,CNN,2019-11-30 15:49:05+00:00,"A Starbucks employee who gave a police officer cups of coffee with the word ""PIG"" printed on the label has been fired, the company said. https://t.co/uKnTjh3qXX"
2197,CNN,2019-11-30 14:16:04+00:00,"A Starbucks employee who gave a police officer cups of coffee with the word ""PIG"" printed on the label has been fired, the company said. https://t.co/Ms0jfQjY8x"
2198,CNN,2019-11-29 13:00:09+00:00,"A police chief in Oklahoma said one of his officers picked up a coffee order from a local Starbucks on Thanksgiving with the word ""PIG"" printed on the label. https://t.co/duuwF1N19M"
2199,CNN,2019-11-29 06:25:04+00:00,"A police officer who picked up a coffee order from Starbucks for dispatchers who were working on Thanksgiving found the cups were labeled with the word ""PIG"" https://t.co/Yx4IqrmoJz"
2200,CNN,2019-11-28 23:31:07+00:00,"Starbucks, Domino's, Panera Bread, and more restaurants are open and serving food this Thanksgiving https://t.co/zYIWbVgYM1"
2201,CNN,2019-11-28 18:00:22+00:00,"Starbucks, Domino's, Panera Bread, and more restaurants are open and serving food this Thanksgiving https://t.co/xaHjknnZYp"
2202,CNN,2019-11-17 15:01:05+00:00,This is the world's largest Starbucks https://t.co/DVSG64DqFd https://t.co/BRLmNhfYon
2203,CNN,2019-11-16 07:46:06+00:00,This is the world's largest Starbucks https://t.co/fZqY1X8b4H https://t.co/GPCLleq8qY
2204,CNN,2019-11-16 04:35:05+00:00,This is the world's largest Starbucks https://t.co/8Tl2b8d31S https://t.co/nOCRd2O2Ex
2205,CNN,2019-11-15 14:20:00+00:00,This is the world's largest Starbucks https://t.co/uWMscU8VQ1 https://t.co/LwHXeZf8X3
2206,CNN,2019-11-15 13:44:18+00:00,"Today's top business headlines:

- Warren hits billionaires in new ad

- Amazon to protest Pentagon’s cloud contract 

- Motorola Razr makes a comeback

- World’s largest Starbucks opens in Chicago

https://t.co/iR5INHjphb https://t.co/56dbZT9Phm"
2207,CNN,2019-11-15 12:37:18+00:00,"Starbucks opened its world's largest Roastery in Chicago today. The five-story location is 35,000 square feet, overtaking the Tokyo Roastery as Starbucks' biggest location. https://t.co/3EYd6p24IC"
2208,CNN,2019-11-06 11:50:05+00:00,Christmas time has arrived at Starbucks once again. https://t.co/uhexxgBWfa
2209,CNN,2019-11-01 23:35:23+00:00,"A former Starbucks regional director has sued the company for wrongful termination, alleging the company discriminated against her in the aftermath of a highly publicized arrest of two black men at a Starbucks store in Philadelphia in April 2018 https://t.co/V9SfmpjLNR"
2210,CNN,2019-11-01 16:10:05+00:00,"The coffee chain is opening ""Starbucks Pick-Up,"" a first-of-its-kind location in the United States that encourages orders from its app. The store, located near New York City's Penn Station, opens Tuesday. https://t.co/YNgMOVyUWE"
2211,CNN,2019-09-19 13:40:10+00:00,"The new store format is called ""Starbucks Pick-Up,"" only accepting orders from the Starbucks app. The first-of-its-kind location in the United States will be located near Penn Station in New York City. Starbucks hasn't announced an opening date. https://t.co/DSN8xLDgUc"
2212,CNN,2019-09-09 18:30:09+00:00,"The man has visited at least 15,061 Starbucks locations on four continents since 1997, he claims. And what started as a quest for espresso became his ticket to the world. ""I call it an extreme hobby,"" he says of the quest to reach them all. https://t.co/87Lz9n8y8C"
2213,CNN,2019-09-06 18:50:05+00:00,Starbucks is opening the world's largest roastery in Chicago. https://t.co/piJMUnaSpN
2214,CNN,2019-09-06 13:50:02+00:00,Starbucks is opening the world's largest roastery in Chicago. https://t.co/l4wE6N4DEA
2215,CNN,2019-09-06 10:42:23+00:00,"Former Starbucks CEO Howard Schultz won't run for president in 2020, ending his exploration of an independent run against President Trump. https://t.co/Bh7d5AWAFL"
2216,CNN,2019-09-05 13:00:04+00:00,Starbucks is planning to improve mental health benefits for US employees in one of its latest bids to attract and retain talent in a tight labor market. https://t.co/eX20xlAUbE
2217,CNN,2019-08-26 10:35:01+00:00,"Beginning Tuesday, Starbucks will sell a Pumpkin Cream Cold Brew drink for the first time. That's in addition to the hot Pumpkin Spice Latte, which has attracted a cult following for the company. https://t.co/xq5JREhsSV"
2218,CNN,2019-08-13 13:26:15+00:00,"Today's top business headlines:

- Trade war fears linger on Wall Street

- US budget deficit rises 27% through July

- Report: Starbucks' pumpkin spice latte returns this month

- Nike launches subscription service for kids

https://t.co/atFI3Nu90L https://t.co/CkdTwLP4Va"
2219,CNN,2019-07-26 10:26:07+00:00,More stores. New products. A better rewards program. It's all working for Starbucks: https://t.co/dRhzizk80a
2220,CNN,2019-07-26 00:10:05+00:00,"Starbucks has put several plans in place to accelerate growth, and they all seem to be working  https://t.co/ttkchKLU1X"
2221,CNN,2019-07-13 00:20:06+00:00,Starbucks wants to declutter stores and remove products customers aren't buying https://t.co/TU8oBWX6Pc
2222,CNN,2019-07-12 21:10:05+00:00,Starbucks wants to declutter stores and remove products customers aren't buying https://t.co/33K13hZCKO
2223,CNN,2019-07-09 07:42:42+00:00,"The six officers who were asked to leave a Starbucks met with company leadership and the chief of police of Tempe, Arizona. The officers were asked to leave after a barista said a customer ""did not feel safe"" because of the large police presence. https://t.co/GH3XpKp3RX"
2224,CNN,2019-07-09 01:35:06+00:00,"The six officers who were asked to leave a Starbucks met with company leadership and the chief of police of Tempe, Arizona. The officers were asked to leave after a barista said a customer ""did not feel safe"" because of the large police presence. https://t.co/Wb03XWQjuj"
2225,CNN,2019-07-08 12:20:04+00:00,"An employee asked the officers ""to move out of the customer's line of sight or to leave,"" according to the Tempe, Arizona, police union. A Starbucks executive apologized and says the company has a ""deep appreciation"" for officers who serve the community. https://t.co/Tj5UIHwUyF"
2226,CNN,2019-06-06 21:55:04+00:00,"Starbucks is opening a coffee shop steps away from Brigham Young University. The school, owned by the Church of Latter-day Saints, abides by an honor code saying students should ""abstain from alcoholic beverages, tobacco, tea, coffee, and substance abuse."" https://t.co/p9CiTxDBsu"
2227,CNN,2019-04-23 09:41:31+00:00,Starbucks' big rival in China has announced plans to go public in the US https://t.co/T2Gdnp1daw https://t.co/gosTjexE8M
2228,CNN,2019-04-23 05:31:02+00:00,Starbucks' big rival in China has announced plans to go public in the US https://t.co/1UWY32b3qC https://t.co/WIrowBvYxT
2229,CNN,2019-03-21 11:11:18+00:00,"Starbucks says it's modernizing its stores to to focus on ""convenience, comfort and connection"" https://t.co/yyyo4AYcEK https://t.co/a1XeNmzoIp"
2230,CNN,2019-03-21 01:41:03+00:00,"Starbucks says it's modernizing its stores to to focus on ""convenience, comfort and connection"" https://t.co/hA14dGNdym https://t.co/8jvhXwzz8N"
2231,CNN,2019-03-19 08:28:36+00:00,Starbucks is changing its rewards program https://t.co/cjNDxIczrN https://t.co/Mgk0630q66
2232,CNN,2019-03-19 06:44:04+00:00,Starbucks is changing its rewards program https://t.co/zEHyQjnqS6 https://t.co/A5Ot5wIMxY
2233,CNN,2019-03-14 23:21:04+00:00,"Former Starbucks CEO Howard Schultz, a potential independent presidential candidate, apologized for claiming that he had ""probably"" spent more time with the military than any other 2020 candidate over the last decade https://t.co/Xy0dlxeho7 https://t.co/W9BdZ5CXuG"
2234,CNN,2019-03-09 14:19:52+00:00,"Could an independent become president?

“The American people are looking for and longing for a second alternative to the two-party system that is broken, dysfunctional, revenge politics every day,” former Starbucks CEO @HowardSchultz tells @smerconish. https://t.co/Y60m8uWNUb https://t.co/NHJ5uMITup"
2235,CNN,2019-03-02 04:11:06+00:00,Starbucks customers are fighting over limited edition 'cat paw cups' in China https://t.co/DItIXROdg6 https://t.co/6LozO1P9PL
2236,CNN,2019-03-01 14:40:46+00:00,Starbucks customers are fighting over limited edition 'cat paw cups' in China https://t.co/YKSCFNto0s https://t.co/7qmDCYuqbE
2237,CNN,2019-02-28 13:14:53+00:00,Forget plastic straws. Starbucks has a cup problem. https://t.co/K2HWj1XaWp https://t.co/8PNLqfbWG1
2238,CNN,2019-02-27 09:08:19+00:00,"Starbucks is opening its fifth ultra-fancy, lavish coffee shop, a 32,000-square-foot ""Roastery,"" in Tokyo https://t.co/TAKtD7YJd6 https://t.co/C70RSfnjdQ"
2239,CNN,2019-02-27 04:46:02+00:00,"Starbucks is opening its fifth ultra-fancy, lavish coffee shop, a 32,000-square-foot ""Roastery,"" in Tokyo https://t.co/4OSG7EbQ5W https://t.co/UoGm6zMHuc"
2240,CNN,2019-02-16 18:52:06+00:00,Howard Schultz must sell his Starbucks shares if he runs for president https://t.co/ODNzWZTqqz https://t.co/NccrhaGqNB
2241,CNN,2019-02-15 04:16:03+00:00,"Howard Schultz's claim that he doesn't ""see color"" is at odds with Starbucks' 2018 anti-bias training videos https://t.co/a73iAI13Du https://t.co/JCdc5Us8kh"
2242,CNN,2019-02-13 22:31:39+00:00,Americans need more opportunities | Former Starbucks CEO Howard Schultz writes for @CNNOpinion https://t.co/SYbXt0rURD https://t.co/A7f3W8DnU7
2243,CNN,2019-02-13 14:14:19+00:00,"Former Starbucks CEO and potential 2020 presidential candidate Howard Schultz on racism: “I didn't see color as a young boy and I honestly don’t see color now."" https://t.co/IUvgDyhtFr https://t.co/wgmWHufjx1"
2244,CNN,2019-02-13 05:42:37+00:00,Former Starbucks CEO Howard Schultz would not commit to getting out of the presidential race if he believed in late 2020 that his candidacy would help President Trump get elected https://t.co/V75QwAUIUS #SchultzTownHall https://t.co/V4nqA4TS29
2245,CNN,2019-02-13 05:21:06+00:00,"Former Starbucks CEO Howard Schultz wouldn't commit to selling off his shares in the coffee company if he were elected president in 2020, responding to a question about his stock during the #SchultzTownHall https://t.co/FRHUZ8kKVK https://t.co/cNMmPKJPKb"
2246,CNN,2019-02-13 04:14:28+00:00,"Howard Schultz on the Starbucks racial profiling incident: “I didn't see color as a young boy and I honestly don’t see color now. … We need to do everything we can to restore the humanity of the country"" and the president plays a large role #SchultzTownHall https://t.co/uDTWNv2WJ0"
2247,CNN,2019-02-13 03:53:01+00:00,"Howard Schultz won’t say if he would sell all his shares in Starbucks if he were to become president, calling it “way premature.""

Schultz goes on to insist he would have no conflicts of interest. “I’m not evading the question.” #SchultzTownHall https://t.co/w5PFGD8Pmn https://t.co/y1eDKuMplZ"
2248,CNN,2019-02-13 02:55:03+00:00,"Could an independent presidential candidacy throw the race to President Trump? Hear from former Starbucks CEO and possible independent 2020 presidential candidate @HowardSchultz in a live town hall 10pET https://t.co/ruXUEDWpnK #schultztownhall

Watch CNN: https://t.co/UYpqI3w42L https://t.co/5PtGJHljRW"
