,Username,Datetime,Text
3041,WSJ,2018-10-24 04:15:06+00:00,First Dunkin’ dropped “Donuts” from its name. Now the chain is making the biggest change to its drinks menu in 15 years in a challenge to Starbucks. https://t.co/T2z2QL6pLm
3042,WSJ,2018-10-14 08:45:05+00:00,"As Starbucks and Nestlé push into Italy, homegrown coffee companies say 'Basta!' https://t.co/oaYZ3sVcW1"
3043,WSJ,2018-10-13 20:30:10+00:00,Lavazza and Illo are trying to assert their independence as global coffee giants Starbucks Corp. and Nestlé SA make incursions into their turf https://t.co/7i96n1ZCKX
3044,WSJ,2018-10-10 08:45:05+00:00,"Bill Ackman thinks Starbucks shares have slumped recently due to a slowdown in same-store sales growth, but he sees growth potential despite recent struggles https://t.co/BvxFvSO2CL"
3045,WSJ,2018-10-09 17:37:02+00:00,Activist investor William Ackman says Pershing Square has a stake in Starbucks https://t.co/ZfMuFinkCx
3046,WSJ,2018-09-06 08:15:05+00:00,“I like Starbucks... but I don’t go there for an Italian espresso and I don’t think very many other Italians will either” https://t.co/MJgne7hL8w
3047,WSJ,2018-09-06 05:15:04+00:00,Starbucks is looking to sell coffee to Italians https://t.co/DSMPo7Rs7i
3048,WSJ,2018-09-02 20:15:05+00:00,Do consumers want a diet Frappuccino? Starbucks is about to find out https://t.co/f2hD8cOxn2
3049,WSJ,2018-08-30 16:16:51+00:00,Twice the sugar as a Snickers bar: Starbucks' Frappuccino sales fell as consumers shifted to healthier drinks https://t.co/njhOPR2X7p
3050,WSJ,2018-08-30 10:45:04+00:00,Do consumers want a diet Frappuccino? Starbucks is about to find out https://t.co/gZnLAGesRC https://t.co/PTw9D0WDpZ
3051,WSJ,2018-07-27 20:45:04+00:00,"California's high court rules that Starbucks must pay employees for off-the-clock work, a decision that could have broad implications for companies that employ hourly workers across the state https://t.co/tJPobsDYKZ"
3052,WSJ,2018-07-24 17:15:06+00:00,"From Jared on 'Silicon Valley' to the bankers in line at Starbucks, how the fleece vest took over the business world https://t.co/4EakalCWkR"
3053,WSJ,2018-07-09 12:15:03+00:00,Starbucks is the next major company to follow a global trend in getting rid of plastic straws https://t.co/U67DZysBPx
3054,WSJ,2018-07-02 19:15:05+00:00,Advisers to Starbucks urged the coffee chain to evaluate managers on goals around 'cultural competency' https://t.co/98WazEZOKm
3055,WSJ,2018-06-20 03:00:09+00:00,"Starbucks plans to close more stores in the increasingly crowded U.S. market.
https://t.co/ni4Fa4rQh7"
3056,WSJ,2018-06-07 13:15:09+00:00,Move over Golden Arches: There are now more Starbucks stores than McDonald's in the U.S. https://t.co/3gKLSi3xd4
3057,WSJ,2018-06-07 10:15:05+00:00,Starbucks has increased the price of a brewed coffee by up to 20 cents across the U.S.  https://t.co/2OmHjXte9V
3058,WSJ,2018-06-07 07:30:04+00:00,"Opinion: Starbucks Chief Won’t Stay Hot, by @HolmanJenkins https://t.co/y47ie6QRvc"
3059,WSJ,2018-06-04 20:56:08+00:00,"Howard Schultz, credited with taking Starbucks from its small beginnings to a behemoth, is stepping down as executive chairman https://t.co/cesPmrAxY1"
3060,WSJ,2018-06-01 13:15:08+00:00,'I don’t think Starbucks realized how uncomfortable it would be': Employees react to coffee chain's antibias training https://t.co/bI9wFWBn6x https://t.co/H37CFpYBpi
3061,WSJ,2018-05-31 17:00:03+00:00,"Starbucks stages full-court press to overhaul its culture, but is going big always the best crisis response? https://t.co/gc6BKr2mrh"
3062,WSJ,2018-05-29 20:15:08+00:00,"As Starbucks closes early for antibias training, customers around the country turn to its competitors for a caffeine fix https://t.co/YBCrMxJKFs"
3063,WSJ,2018-05-29 18:55:07+00:00,How Starbucks’ antibias training could benefit McDonalds’ and Dunkin’ Donuts https://t.co/4RhACYMEFJ
3064,WSJ,2018-05-26 15:40:01+00:00,A worker pricked by a syringe and blood splattered on the walls. Starbucks faces the daunting task of cleaning up its now-public bathrooms https://t.co/3JaV1wEBR1
3065,WSJ,2018-05-26 13:20:04+00:00,"Starbucks is hoping anti-bias training will help prevent fraught encounters like the one that led to the arrest of two black men, but how effective it will be is an open question https://t.co/w73GcgvpIR"
3066,WSJ,2018-05-25 15:30:13+00:00,A worker pricked by a syringe and blood splattered on the walls. Starbucks faces the daunting task of cleaning up its now-public bathrooms https://t.co/F1bl9jsE4S
3067,WSJ,2018-05-24 21:30:14+00:00,"Opinion: Starbucks tried to appease outraged progressivism. It found out that is impossible, writes @DanHenninger https://t.co/hHsZO7xnxR"
3068,WSJ,2018-05-24 19:00:18+00:00,A worker pricked by a syringe and blood splattered on the walls. Starbucks faces the daunting task of cleaning up its now-public bathrooms https://t.co/gNLo1cDfrj
3069,WSJ,2018-05-24 15:15:33+00:00,Consumers ranked Starbucks 20th in terms of bathroom cleanliness out of 62 fast-food chains in a recent customer survey https://t.co/wH2ZAiAP5E https://t.co/4i7ZyxhnUL
3070,WSJ,2018-05-24 12:00:04+00:00,Starbucks' new bathroom policy sparks concerns among customers and employees about cleanliness and safety https://t.co/zcZth6IDss
3071,WSJ,2018-05-19 16:03:22+00:00,Starbucks tells employees in a letter that everyone is “considered a customer” https://t.co/NnSwMLYct0
3072,WSJ,2018-05-08 17:05:02+00:00,Good afternoon: It's time for 'happy hour'--at Starbucks? https://t.co/08euUFGeC8 https://t.co/4hp8TRqRih
3073,WSJ,2018-05-07 13:38:11+00:00,"Starbucks Reserve, Seattle’s Best Coffee and Teavana will be added to Nestlé’s existing coffee portfolio, which includes Nescafé and Nespresso brands https://t.co/JzRuQmPQbR"
3074,WSJ,2018-05-07 06:00:04+00:00,"Nestlé says Starbucks will receive an upfront cash payment of $7.15 billion as part of a global perpetual license
https://t.co/3OLw4bwtXu"
3075,WSJ,2018-05-02 22:50:05+00:00,"Two men arrested at Philadelphia Starbucks agree to settlement that includes a $200,000 grant to help local students https://t.co/mS5ax8SLcH"
3076,WSJ,2018-04-30 19:10:04+00:00,"Opinion: Starbucks is not the next Selma, writes @BobWoodson https://t.co/ONADFTNKE6"
3077,WSJ,2018-04-27 04:32:31+00:00,"Starbucks’s chief executive promised to prevent an incident like the arrest of two black men at one of its coffee shops in Philadelphia this month from reoccurring
https://t.co/6H0hbDUOop"
3078,WSJ,2018-04-25 16:15:03+00:00,The plan by Starbucks to shut its stores and train every employee to reduce bias could answer how well those programs work—if it’s done right. https://t.co/WTnTnOUALG
3079,WSJ,2018-04-23 08:45:05+00:00,Interviews with current and former Starbucks managers and baristas suggest the company’s guidelines on how to treat lingering nonpaying customers are vague at best—if they exist at all https://t.co/LofeSAflOA
3080,WSJ,2018-04-22 00:50:03+00:00,"Starbucks doesn’t have a consistent policy on how long customers are allowed to hang out without buying something, current and former managers and baristas say
https://t.co/lrZ3B4tG1f"
3081,WSJ,2018-04-21 11:22:26+00:00,"Starbucks fosters the idea that customers are welcome to hang out in its cafes, but there's no clear policy on how long https://t.co/86NQzE6PCA"
3082,WSJ,2018-04-18 22:00:20+00:00,Top Starbucks executives and Philadelphia clergy and community leaders met to discuss the coffee company playing a leading role in addressing racial injustice https://t.co/cCr5OtEqFn
3083,WSJ,2018-04-18 07:15:07+00:00,"Starbucks is planning antibias training for employees at more than 8,000 company-owned cafes after the backlash over arrests of two black men
https://t.co/4vtkU1bzy4"
3084,WSJ,2018-04-17 19:46:23+00:00,"Starbucks will temporarily close more than 8,000 U.S. stores on May 29 to conduct racial-bias education https://t.co/VWoovw7b5x"
3085,WSJ,2018-04-16 14:40:06+00:00,Does coffee cause cancer? Starbucks and a group of coffee companies say that trace amounts of acrylamide--listed by California as cancer-causing--isn't harmful https://t.co/56zZZB6Iye
3086,WSJ,2018-04-15 17:36:58+00:00,Starbucks says it will investigate after two black men were arrested at a store in Philadelphia https://t.co/DlLKqKnJJk
3087,WSJ,2018-04-15 13:35:48+00:00,"Starbucks apologizes, plans to investigate incident that led to handcuffing of two black men in Philadelphia https://t.co/szNkYkGId2"
3088,WSJ,2018-03-17 22:20:04+00:00,Obituary: Orin Smith 'was the guy who had to make it work' at Starbucks https://t.co/x9hd2TuwUD
3089,WSJ,2018-03-05 07:00:21+00:00,"Who do you bring in to guide an intricate merger? Albertsons and Rite Aid have called on a retail veteran who once headed Starbucks
https://t.co/gSVzajVXiJ"
3090,WSJ,2018-02-19 17:15:07+00:00,"In Sochi, NBC had an employees-only Starbucks. How could they top it in Pyeongchang? Their own Peloton spin studio. @jasongay saddles up https://t.co/126O3V5Des"
3091,WSJ,2018-02-19 11:45:11+00:00,"Four years ago, they had a secret Starbucks. Now NBC has a Peloton spinning class at the Olympics. @jasongay goes for a ride  https://t.co/ZZQR6bJDvB"
3092,WSJ,2018-01-26 01:15:05+00:00,"Starbucks said it expects slowing traffic in the U.S., resulting from a crowded coffee market, to extend into its second fiscal quarter https://t.co/WSofkCtb8w"
3093,WSJ,2018-01-16 20:00:17+00:00,Starbucks reached a settlement in a lawsuit over the closure of its Teavana stores https://t.co/fbBkOOZwOB
3094,WSJ,2017-12-05 18:16:07+00:00,A judge grants preliminary injunction to halt Starbucks from closing Teavana tea shops in 77 Simon Property malls https://t.co/46do3TJbla
3095,WSJ,2017-11-10 04:30:05+00:00,"Why that Starbucks latte in Cairo costs almost four times more In Zurich
https://t.co/YSMgbh8F3W https://t.co/DunmoV9BOl"
3096,WSJ,2017-11-09 23:40:08+00:00,Why that Starbucks latte in Cairo costs almost four times more In Zurich https://t.co/YHtpr0ptn5
3097,WSJ,2017-11-07 12:20:12+00:00,Starbucks to bring Princi Italian bakery to Seattle Roastery https://t.co/fXZ0oDD468
3098,WSJ,2017-11-07 09:20:04+00:00,An Italian luxury bakery is Starbucks' latest move into high-end food https://t.co/al5DHu6N8t
3099,WSJ,2017-11-03 15:16:04+00:00,"The next time you go to Starbucks, think of the days when coffee’s social effects were part of the 'euphoria' https://t.co/WPb0fVhMSI"
3100,WSJ,2017-11-03 05:59:58+00:00,"Starbucks reported a U.S. same-store sales increase of 2%, below the company’s benchmark of 5% growth
https://t.co/kawSwO19qq"
3101,WSJ,2017-09-26 22:30:12+00:00,"Kohl’s first female CEO, Michelle Gass, helped develop the Frappuccino while at Starbucks https://t.co/ArHP8YrVvD"
3102,WSJ,2017-09-05 20:59:05+00:00,"The unicorn suit was dismissed with prejudice, meaning the cafe is barred from suing Starbucks again over the drink https://t.co/YC6cFOwRG0"
3103,WSJ,2017-07-05 23:37:07+00:00,"A coffee shop in Williamsburg, Brooklyn, has locked unicorn horns with Starbucks https://t.co/HT8WiW7zvn"
3104,WSJ,2017-07-05 20:02:53+00:00,"A Brooklyn coffee shop is taking on Starbucks in a Unicorn Latte court fight
https://t.co/XA65K6gQNK"
3105,WSJ,2017-04-27 21:26:24+00:00,Starbucks misses growth expectations in U.S. stores https://t.co/U4BmNaj10T $SBUX
3106,WSJ,2017-04-03 05:15:07+00:00,Starbucks’ new CEO on how he plans to jolt slowing growth https://t.co/VjW1YjTH4u
3107,WSJ,2017-03-26 21:46:03+00:00,Starbucks plans to hire more U.S. military veterans after facing backlash over its promise to hire refugees https://t.co/tvPxhrLLcT
3108,WSJ,2017-03-22 23:03:06+00:00,Starbucks plans to hire more U.S. military veterans after facing backlash over its promise to hire refugees https://t.co/VKddLvvOHb
3109,WSJ,2017-01-31 00:12:02+00:00,Starbucks’ pledge to hire refugees meets boycott threat https://t.co/1KiY056Jsv
3110,WSJ,2017-01-27 12:20:16+00:00,Starbucks says it has become a victim of the success of its mobile order app https://t.co/MOLXlXQxtb
3111,WSJ,2017-01-27 00:17:04+00:00,Starbucks says it has become a victim of the success of its mobile order app https://t.co/WrQjp4Gwui
3112,WSJ,2017-01-25 21:37:03+00:00,No turnaround in sight for Starbucks https://t.co/Kk64sKVHEa
3113,WSJ,2016-12-09 05:10:40+00:00,"‘Pokémon Go’ adds Starbucks stores as Gyms and PokéStops 
https://t.co/kQfGptlddx"
3114,WSJ,2016-12-08 19:37:31+00:00,‘Pokémon Go’ adds Starbucks stores as Gyms and PokéStops https://t.co/sIP3D7VMDX
3115,WSJ,2016-12-07 15:01:53+00:00,Starbucks's CEO transition plan is fairly unusual in corporate America https://t.co/kcbe8MbFD8
3116,WSJ,2016-12-06 01:11:03+00:00,"As its core clientele loses spending power, Starbucks readies push into realm of $12-a-cup java https://t.co/mH8tQzTwl8"
3117,WSJ,2016-12-05 20:16:25+00:00,Middle-market woes inspire Starbucks’s bet on luxury coffee https://t.co/xENVo8IhCh
3118,WSJ,2016-12-04 16:42:16+00:00,Howard Schultz is stepping down as CEO of Starbucks to focus on creating a new chain of high-end coffee spots https://t.co/ahaF3nsKth
3119,WSJ,2016-12-02 00:47:07+00:00,Starbucks CEO Howard Schultz is stepping down to devote his time to opening high-end coffee shops https://t.co/fN4yTVXMKz
3120,WSJ,2016-12-01 21:03:54+00:00,Howard Schultz is stepping down as CEO of Starbucks https://t.co/ytPWlFsQcy
3121,WSJ,2016-11-03 23:35:04+00:00,Starbucks’s financial results beat Wall Street expectations in the most recent quarter https://t.co/FZMNbPzyKO 🔓
3122,WSJ,2016-10-16 13:00:20+00:00,"Starbucks, Blue Bottle and other big names in coffee are descending on Congo in search of the next great bean https://t.co/NKgxD1HMDP 🔓"
3123,WSJ,2016-10-14 17:00:13+00:00,"Starbucks, Blue Bottle and other big names in coffee are descending on Congo in search of the next great bean https://t.co/a6GLD3KnTv 🔓"
3124,WSJ,2016-08-24 22:44:03+00:00,Tornado flattens a Starbucks in Indiana; no injuries reported https://t.co/2x55FZW52G 🔓
3125,WSJ,2016-08-24 16:09:06+00:00,Too much ice in Starbucks' drinks? Judge says no https://t.co/ePxX7BALmZ 🔓
3126,WSJ,2016-08-20 19:40:15+00:00,NBC’s secret Olympic Starbucks supply dries up. https://t.co/2Njx1SHUH5 🔓
3127,WSJ,2016-07-25 19:30:11+00:00,"Even small doses of caffeine, about what’s in a “tall” Starbucks coffee, can improve athletic performance https://t.co/s9Rgwh3H3i"
3128,WSJ,2016-07-25 15:50:04+00:00,"Even small doses of caffeine, equivalent to what’s in a “tall” Starbucks coffee, can improve athletic performance. https://t.co/U5grnvOOi6"
3129,WSJ,2016-07-23 02:41:14+00:00,Starbucks attributed disappointing results to political and social unrest at home and abroad https://t.co/hWxyN5Rikn
3130,WSJ,2016-07-12 11:25:02+00:00,Starbucks raises prices on some drinks https://t.co/I7msMMiepx
3131,WSJ,2016-07-11 15:15:05+00:00,"If you work at Starbucks, your pay could be going up 5% or more this fall https://t.co/f0qWUiFa9o"
3132,WSJ,2016-06-01 21:23:05+00:00,"From PayPal to Starbucks apps, where money lives: https://t.co/D9xvXC4Jdc"
3133,WSJ,2016-05-31 13:27:06+00:00,Starbucks Adds Nitro Cold Brew and Other Summer Drinks https://t.co/PEVBvlzjHF
3134,WSJ,2016-05-18 14:04:04+00:00,The Starbucks app spoils the pun of serving up the rong gname https://t.co/ExrKcuiw8h
3135,WSJ,2016-05-17 22:23:04+00:00,The Starbucks app spoils the pun of serving up the rong gname https://t.co/RsBs9HGmG4
3136,WSJ,2016-05-17 19:51:33+00:00,Starbucks spoils the pun of serving up the rong gname with app perfection https://t.co/ozBRRFCfp4 https://t.co/PGA101n9Aj
3137,WSJ,2016-05-16 23:18:02+00:00,Starbucks to raise $500 million in sustainability bond https://t.co/Mp7Tc9ZEXG
3138,WSJ,2016-05-04 15:21:07+00:00,Companies like Whole Foods and Starbucks are betting that customers will pay more for slow-grown chicken https://t.co/CjNu9K8snW
3139,WSJ,2016-05-03 00:21:02+00:00,Starbucks is accused of putting too much ice in your iced coffee https://t.co/hd4HXS6rIt via @WSJLawBlog
3140,WSJ,2016-05-02 17:42:03+00:00,Starbucks is accused of putting too much ice in your iced coffee https://t.co/zM8fA2HEZf via @WSJLawBlog
3141,WSJ,2016-05-02 16:35:04+00:00,Starbucks is accused of putting too much ice in your iced coffee https://t.co/FmCULFaO8u via @WSJLawBlog
3142,WSJ,2016-04-21 20:37:02+00:00,Starbucks' earnings forecast for the current quarter came in short of expectations https://t.co/IewKulla7L
3143,WSJ,2016-04-21 13:44:50+00:00,Starbucks opens first store in South Africa https://t.co/6zMK15OSBz
3144,WSJ,2016-04-11 00:05:01+00:00,Starbucks is going to open its largest store in the world in Manhattan https://t.co/WhZKBxITk3
3145,WSJ,2016-04-05 23:21:02+00:00,Starbucks is going to open its largest store in the world in Manhattan https://t.co/JRGhhPmJdz https://t.co/owfrpbet29
3146,WSJ,2016-04-05 21:05:06+00:00,Starbucks is going to open its largest store in the world in Manhattan https://t.co/3HtHVasjsd
3147,WSJ,2016-03-25 15:42:02+00:00,"Talk about close competition: In NYC, Dunkin' Donuts is opening right next door to Starbucks https://t.co/ZxP2Q8wBfW https://t.co/ZjnWMg9Szm"
3148,WSJ,2016-03-23 18:02:07+00:00,Starbucks says it's expanding customer rewards program beyond its coffee shops to other retailers https://t.co/4rj182vjSY
3149,WSJ,2016-03-04 07:33:17+00:00,"Mamma mia! As Starbucks looms, Italians warm to U.S.-style coffee
https://t.co/I9UyZxnFPi https://t.co/JNw89hDhrI"
3150,WSJ,2016-03-03 20:28:21+00:00,"Flavored blends, paper cups and Starbucks—Italy’s coffee lovers are jolted by U.S. invasion https://t.co/tLya4Ijm3s https://t.co/DhyRrgqfRe"
3151,WSJ,2016-02-28 05:14:37+00:00,Starbucks is changing its loyalty program https://t.co/da10ZVIQT8 https://t.co/UdLKuFMlPj
3152,WSJ,2016-02-22 23:18:32+00:00,"Apple wants encryption committee, Starbucks shakes up rewards and 3 more top stories: https://t.co/IWVKk7BiC5 https://t.co/sbMLGjjeAx"
3153,WSJ,2016-02-22 20:55:06+00:00,Starbucks is changing its loyalty program https://t.co/NsIzzcSV9S https://t.co/qefRH4a1P0
3154,WSJ,2016-02-22 16:41:04+00:00,Starbucks is changing its loyalty program https://t.co/DMQI7MkydI https://t.co/0tvF4SQw8C
3155,WSJ,2016-01-26 05:12:08+00:00,Starbucks CEO total pay valued at $20.1 million in 2015 https://t.co/LHrmaCoejV  $SBUX
3156,WSJ,2016-01-13 04:11:26+00:00,"Starbucks aims to open 500 stores a year in China every year for five years 
https://t.co/0VWQCimA3n"
3157,WSJ,2016-01-12 17:03:02+00:00,Starbucks is upping its bet on Chinese consumers’ taste for coffee https://t.co/KmhG1RuqfN https://t.co/iBV81Lph2l
3158,WSJ,2016-01-12 07:00:10+00:00,"Starbucks plans thousands of new stores in China
https://t.co/Oejw0bufLR https://t.co/WejaFViIim"
3159,WSJ,2015-10-21 09:57:37+00:00,EU rules that Starbucks and Fiat benefited from illegal tax deals https://t.co/aIqJGAHoJD
3160,WSJ,2015-10-15 10:35:03+00:00,The EU  is expected to rule that Starbucks and Fiat benefited from illegal tax deals next week http://t.co/gmr3Omid8Z
3161,WSJ,2015-10-09 17:58:52+00:00,Starbucks and Nespresso enter warzones in scramble for African coffee http://t.co/X4myiT1Wmt http://t.co/W4AAb1yIA9
3162,WSJ,2015-10-07 02:45:08+00:00,Starbucks hires first chief technology officer http://t.co/DzRn7ZL9eK
3163,WSJ,2015-08-20 18:32:03+00:00,"No longer content to be your neighborhood cafe, Starbucks wants to be your local tavern too, writes @CharlesPassy: http://t.co/RSmdTujOmo"
3164,WSJ,2015-07-23 20:55:31+00:00,Starbucks profit jumps as revenue surges 18% http://t.co/Yryb703IXr $SBUX
3165,WSJ,2015-07-14 20:26:10+00:00,Starbucks will open stores in South Africa starting next year: http://t.co/J4ivOBenvx
3166,WSJ,2015-07-13 18:35:11+00:00,"Starbucks is leading a multi-company initiative to increase hiring of young, minority workers: http://t.co/sH8GsNCPVM http://t.co/bcqH1U1ywm"
3167,WSJ,2015-07-07 00:29:05+00:00,Starbucks​ is raising some drink prices by 5 to 20 cents starting tomorrow. http://t.co/quC0rtXPq9
3168,WSJ,2015-07-06 21:32:06+00:00,Starbucks raises prices by about 1% despite declining coffee costs.    http://t.co/1qWSU6HsD0 $SBUX http://t.co/5hgY9mJNvH
3169,WSJ,2015-05-19 20:05:04+00:00,Starbucks will let Spotify subscribers to get reward points they can redeem at its coffee shops. http://t.co/KBLMB4jY1U
3170,WSJ,2015-05-19 10:26:27+00:00,Starbucks flap highlights Korean startup that’s pushing anonymous mobile messaging  http://t.co/PfgHiRx0Ax $SBUX http://t.co/9c1xnPlQV6
3171,WSJ,2015-05-19 05:00:38+00:00,Starbucks flap highlights Korean startup that’s pushing anonymous mobile messaging  http://t.co/FRRQNtUf4z $SBUX http://t.co/kVrVKdVzhD
3172,WSJ,2015-05-11 23:19:03+00:00,Jury finds Starbucks not liable for police officer's injuries after he spilled a cup of coffee on his lap. http://t.co/g4muTQyiHS
3173,WSJ,2015-05-06 17:16:10+00:00,"For Starbucks worker Ivette Agosto, years of serving coffee to bankers got her noticed - and hired: http://t.co/x4wmnFde9q"
3174,WSJ,2015-05-05 09:00:37+00:00,"EU delays decisions on tax probes into Apple, Amazon, Fiat and Starbucks http://t.co/RqVIsdZpgq http://t.co/waDH4ppOe5"
3175,WSJ,2015-04-23 23:38:05+00:00,Starbucks revenue rises as worldwide traffic grows: http://t.co/wOO74RSKZk $SBUX
3176,WSJ,2015-04-07 16:14:07+00:00,Starbucks’s tax practices in Europe are under scrutiny for the 2nd time in just over two years http://t.co/FiuPg7g79u http://t.co/2rM8AbDOy1
3177,WSJ,2015-03-24 16:06:06+00:00,Why Starbucks takes on social issues such as the race relations campaign: http://t.co/34mdRWDnLM http://t.co/bhs0iPWYYI
3178,WSJ,2015-03-24 10:30:11+00:00,Starbucks is continuing some aspects of its race relations campaign. Here's why: http://t.co/psgjzY6FB0 $SBUX
3179,WSJ,2015-03-23 12:27:35+00:00,"Starbucks will no longer ask employees to put ""Race Together"" on cups: http://t.co/gHeSHdE5IO $SBUX http://t.co/24FyRyvEOL"
3180,WSJ,2015-02-22 12:18:44+00:00,Starbucks launched a new coffee delivery service: http://t.co/ntk1gSOZpM $SBUX
3181,WSJ,2015-02-17 18:09:39+00:00,Starbucks launches a new coffee delivery service: http://t.co/RkJCMcEzea $SBUX
3182,WSJ,2014-12-06 01:55:06+00:00,"1 in 4 U.S. Starbucks could sell wine and beer in the next five years. Today, 32 do. http://t.co/Kb0Pz7JTGb"
3183,WSJ,2014-11-14 18:45:09+00:00,"A tax deal struck by Starbucks in the Netherlands may constitute illegal state aid, EU says http://t.co/8S4dFQ32RL http://t.co/I3cev9REnS"
3184,WSJ,2014-11-14 10:27:52+00:00,"A tax deal struck by Starbucks in the Netherlands may constitute illegal state aid, EU says http://t.co/JmbEsXQ9Im http://t.co/3iyw5D78Xt"
3185,WSJ,2014-11-14 07:38:25+00:00,Breaking: European Union says Starbucks' Dutch tax deal may constitute illegal state aid http://t.co/tYCeEMKwOo
3186,WSJ,2014-09-05 22:22:25+00:00,"Starbucks wants to offer you speedier service via smaller, express-style stores http://t.co/wWEEr2JUYd (AP) http://t.co/b6hAvOhdOX"
3187,WSJ,2014-09-05 11:35:42+00:00,"Starbucks says it plans to cater to busy commuters by launching smaller, express-style stores. http://t.co/PuE4nplP52"
3188,WSJ,2014-07-27 13:22:59+00:00,"A Starbucks store manager makes an average $44,632 salary, compared with $92,462 at Wal-Mart. http://t.co/iQU2jCUDgv $SBUX $WMT"
3189,WSJ,2014-07-26 04:43:44+00:00,"A Starbucks store manager makes an average $44,632 salary, compared with $92,462 at Wal-Mart. http://t.co/dGpieD9L1A $SBUX $WMT"
3190,WSJ,2014-07-23 16:25:08+00:00,Starbucks opens first store in Hanoi: http://t.co/oqVDzDXI2S http://t.co/9QkdQGrhYJ
3191,WSJ,2014-07-23 06:04:36+00:00,"U.S.-owned meat supplier in China accused of selling expired meat prompts McDonald's, Starbucks to sever ties http://t.co/S4n8GIzwwy"
3192,WSJ,2014-07-20 21:16:04+00:00,Starbucks will start accepting pickup orders via its app later this year: http://t.co/Y9luMcPJ2j
3193,WSJ,2014-06-21 01:40:07+00:00,Your Starbucks Venti is about to cost a little more: http://t.co/tecMtXdYK6 $SBUX
3194,WSJ,2014-06-16 21:16:06+00:00,Starbucks says it will pay for an online degree for some of its U.S. employees http://t.co/gH11vEaxKi
3195,WSJ,2014-06-16 10:43:08+00:00,Starbucks to subsidize online bachelor's degrees for U.S. employees.  http://t.co/badt0aEEAl
3196,WSJ,2014-06-11 09:02:49+00:00,EU to open probe into tax affairs of Apple and Starbucks in Europe. Full story: http://t.co/7eloOEIwFq
3197,WSJ,2014-06-11 08:40:54+00:00,"Breaking: EU to open probe into tax affairs of Apple, Starbucks in Europe, say people familiar with the matter. http://t.co/tYCeEMbSEk"
3198,WSJ,2014-03-25 07:26:35+00:00,Mobile payment now represents 14% of all Starbucks in-store transactions in the U.S. http://t.co/drMND8P2FL
3199,WSJ,2014-02-21 17:12:52+00:00,"NBC's ""secret"" Olympic Starbucks goes on lockdown after being publicized http://t.co/tQOGtWpykE"
3200,WSJ,2014-02-21 08:22:40+00:00,NBC's secret Sochi Starbucks goes on lockdown: http://t.co/I2tZ92ga5l
3201,WSJ,2014-02-11 20:48:06+00:00,"Turns out ""Dumb Starbucks"" was just a stunt by a TV comedian: http://t.co/TeWSQS58oC"
3202,WSJ,2013-12-17 22:02:36+00:00,"Farewell, cash. A third of Starbucks payments are made using loyalty cards, another 10% come from its mobile app. http://t.co/oByb8tlJcq"
3203,WSJ,2013-10-27 17:34:49+00:00,Chart: breakdown of the cost of a Starbucks latte in China http://t.co/2awng01BQI http://t.co/ZjN7bFWE0e
3204,WSJ,2013-10-22 06:26:18+00:00,"China Central Television condemned Starbucks prices in China, saying its profit margin is excessive. http://t.co/2Vg3DchAwZ $SBUX"
3205,WSJ,2013-10-22 03:24:41+00:00,Chart: breakdown of the cost of a Starbucks latte in China http://t.co/dtb2vFByub http://t.co/Ewcfo4lK2s
3206,WSJ,2013-10-03 02:12:56+00:00,"Starbucks has been swapping out Kind granola bars, Peeled fruit snacks in favor of products from companies it owns http://t.co/d0DzXSevVl"
3207,WSJ,2013-09-20 02:16:22+00:00,"""We're not anti- or pro-gun, but we don't believe guns should be part of the Starbucks experience,"" CEO said. http://t.co/64Q5O1wLfa $SBUX"
