,Username,Datetime,Text
1043,CNBC,2016-12-07 16:59:55+00:00,"Starbucks unveils plans for 12,000 new stores over next 5 years https://t.co/RPHyGDxhH5"
1044,CNBC,2016-12-07 13:52:36+00:00,Starbucks courts millennials with $10 coffee at new Reserve bars https://t.co/xvMBTn3LXU
1045,CNBC,2016-12-03 00:53:27+00:00,13 inspiring quotes on leadership and success from Starbucks CEO Howard Schultz https://t.co/5OkYXTUUaZ via @cnbcmakeit
1046,CNBC,2016-12-02 18:04:27+00:00,Wall Street says buy the Starbucks dip on Schultz's exit https://t.co/AzZfQhzUAS via @cnbcpro
1047,CNBC,2016-12-02 15:41:15+00:00,"New Starbucks CEO needs to do one thing to keep shareholders happy, top analyst says https://t.co/UwHGR82mKV"
1048,CNBC,2016-12-02 13:47:53+00:00,EXCLUSIVE: Billionaire Howard Schultz says Starbucks is cool with Trump and his supporters https://t.co/ZNKjNDcQZP
1049,CNBC,2016-12-02 12:56:52+00:00,"Would Starbucks CEO like to run for president in the future?

Schultz: ""I am all in at Starbucks and that is my focus at this time"" https://t.co/fbCaRSGsYQ"
1050,CNBC,2016-12-02 12:48:57+00:00,"Starbucks CEO Schultz: Don't think Starbucks or its brand are ""at odds"" with Trump admin. or his supporters"
1051,CNBC,2016-12-02 12:44:55+00:00,"Starbucks outgoing CEO on company's high-end Reserve business: ""It has far exceeded our expectations"", will build out new retail format https://t.co/lr7uNelSzZ"
1052,CNBC,2016-12-02 12:42:41+00:00,"Starbucks incoming CEO says of outgoing CEO Schultz: I'm ""following someone who is an iconic entrepreneur and leader"" https://t.co/ohIv6J8WcV"
1053,CNBC,2016-12-02 12:40:44+00:00,"Starbucks incoming CEO says company's strategic plan is ""the most ambitious...in the history of the company"" https://t.co/Wjqqk4772C"
1054,CNBC,2016-12-02 12:38:22+00:00,"Starbucks' Howard Schultz: ""I think the stock is undervalued"""
1055,CNBC,2016-12-02 12:36:49+00:00,Outgoing Starbucks CEO Howard Schultz: Kevin Johnson better prepared to be CEO https://t.co/tdPnLKjEbH https://t.co/vsX3NpTSr0
1056,CNBC,2016-12-02 12:35:48+00:00,"Starbucks outgoing CEO Schultz: More ""emotionally"" ready to step back from company now"
1057,CNBC,2016-12-02 12:31:54+00:00,NOW on @CNBC: Starbucks outgoing chairman &amp; CEO Howard Schultz and incoming CEO Kevin Johnson join @andrewrsorkin and @jimcramer LIVE https://t.co/IEkYnmIdAU
1058,CNBC,2016-12-02 12:06:27+00:00,Meet the tech guy who is about to take over Starbucks https://t.co/qOBdukNrJe
1059,CNBC,2016-12-02 12:05:06+00:00,"Coming up shortly, FIRST on @CNBC: @andrewrsorkin &amp; @jimcramer interview Starbucks' Howard Schultz &amp; Kevin Johnson. https://t.co/Y72RPkVfL1"
1060,CNBC,2016-12-02 03:47:56+00:00,Cramer reacts to Starbucks: Schultz is deeply linked to the success of the company https://t.co/fCts3OeuJi via @madmoneyoncnbc
1061,CNBC,2016-12-01 23:47:22+00:00,Howard Schultz on why he's stepping down as Starbucks CEO https://t.co/L6zK7ChQUr
1062,CNBC,2016-12-01 22:23:15+00:00,Starbucks shares fall as CEO Schultz steps down https://t.co/zxmmE1A0Oa
1063,CNBC,2016-12-01 21:17:08+00:00,FIRST on @CNBC: Outgoing Starbucks CEO Howard Schultz &amp; incoming CEO Kevin Johnson will be live on @SquawkCNBC at 7:30a ET tomorrow. https://t.co/IP4L2w2FKp
1064,CNBC,2016-12-01 21:15:32+00:00,Howard Schultz stepping down as Starbucks CEO https://t.co/E6lsB6KiRx
1065,CNBC,2016-12-01 21:01:39+00:00,BREAKING: Howard Schultz stepping down as Starbucks CEO https://t.co/a2TwNmrDH0 https://t.co/XtIrX6GOXv
1066,CNBC,2016-11-21 18:48:05+00:00,"Starbucks hikes prices for some beverages, bakery goods https://t.co/pYI4pmGW6Y"
1067,CNBC,2016-11-17 03:51:21+00:00,"Cramer says 'lurking buyers' propped up stocks like Disney, NVIDIA and Starbucks https://t.co/OsmLIYsoSS via @madmoneyoncnbc"
1068,CNBC,2016-11-14 10:05:24+00:00,How 'Shark Tank' helped this company hit $2 million and get a deal with Starbucks https://t.co/tH8qxXR9R8 via @cnbcmakeit
1069,CNBC,2016-11-13 16:44:51+00:00,How this 'Shark Tank'-backed bagel maker bagged a deal with Starbucks https://t.co/qCXOTblAIt via @cnbcmakeit
1070,CNBC,2016-11-11 15:09:51+00:00,How two French bakers got their product onto shelves at Starbucks https://t.co/UQ6sqzviW1 via @cnbcmakeit
1071,CNBC,2016-11-11 00:10:24+00:00,Starbucks CEO Schultz digs into the answer to hiring veterans https://t.co/DyACEgzKUF via @madmoneyoncnbc
1072,CNBC,2016-11-09 18:24:43+00:00,Starbucks CEO: 'I trust all that is good in our country' https://t.co/sYu03DzIjw
1073,CNBC,2016-11-04 21:07:41+00:00,How the election is affecting Starbucks' business https://t.co/qYqBcbzBUr
1074,CNBC,2016-11-04 10:12:21+00:00,Starbucks shares rise after earnings beat https://t.co/X5UqhiqGgd
1075,CNBC,2016-11-03 20:07:19+00:00,EARNINGS: Starbucks Q4 EPS $0.56 Adj. vs. $0.55 Est.; Q4 Revs. $5.71B vs. $5.68B Est. • $SBUX up 6% https://t.co/jY6SG4RQ8Z https://t.co/E8hByJAWgx
1076,CNBC,2016-11-02 16:13:18+00:00,Starbucks' new 'unity' cup draws fire ahead of election https://t.co/a4QVt4uLiA
1077,CNBC,2016-10-28 19:03:23+00:00,"Starbucks barista peeks at new holiday cups, posts to Reddit https://t.co/q7Nhvph0Fj"
1078,CNBC,2016-10-23 07:19:26+00:00,How 'Shark Tank' helped this company hit $2 million and get a deal with Starbucks https://t.co/467YyfFXAt via @cnbcmakeit
1079,CNBC,2016-10-23 01:32:34+00:00,How this 'Shark Tank'-backed bagel maker bagged a deal with Starbucks https://t.co/avcKNixd57 via @cnbcmakeit
1080,CNBC,2016-10-19 22:33:56+00:00,CEO Howard Schultz: Starbucks remains 'very bullish on the Chinese economy' https://t.co/vsM4p4qtSf
1081,CNBC,2016-10-18 03:09:54+00:00,How 'Shark Tank' helped this company hit $2 million and get a deal with Starbucks https://t.co/QT50nNp61j via @cnbcmakeit
1082,CNBC,2016-10-17 20:04:09+00:00,Trader makes a risky bet that Starbucks is set to sink https://t.co/Aq5FXv9vai via @tradingnation
1083,CNBC,2016-10-17 04:30:34+00:00,How this 'Shark Tank'-backed bagel maker bagged a deal with Starbucks https://t.co/XNNDPt5xFB via @cnbcmakeit
1084,CNBC,2016-10-13 18:07:51+00:00,Pumpkin chai pie latte? Starbucks baristas curate the menu https://t.co/7a10sJm62C
1085,CNBC,2016-10-08 23:55:08+00:00,How 'Shark Tank' helped this company hit $2 million and get a deal with Starbucks https://t.co/PC6uqLglnw via @cnbcmakeit https://t.co/Adz4b0to82
1086,CNBC,2016-10-06 13:13:47+00:00,How 'Shark Tank' helped this company hit $2 million and get a deal with Starbucks https://t.co/0FOmBXmc6B via @cnbcmakeit https://t.co/MBTdIs6ggV
1087,CNBC,2016-10-06 06:59:46+00:00,How this 'Shark Tank'-backed bagel maker bagged a deal with Starbucks https://t.co/lXevEbzdj8 via @cnbcmakeit https://t.co/unNSR3bnSr
1088,CNBC,2016-09-25 22:30:33+00:00,How 'Shark Tank' helped this company hit $2 million and get a deal with Starbucks https://t.co/fq2uk8t9CA via @cnbcmakeit
1089,CNBC,2016-09-12 20:12:21+00:00,How 'Shark Tank' helped this company hit $2 million and get a deal with Starbucks https://t.co/sddr5tPVHK via @cnbcmakeit
1090,CNBC,2016-09-11 07:24:05+00:00,How this 'Shark Tank'-backed bagel maker bagged a deal with Starbucks https://t.co/Too5s3IxrN via @cnbcmakeit
1091,CNBC,2016-09-09 14:09:30+00:00,How this 'Shark Tank'-backed bagel maker bagged a deal with Starbucks https://t.co/1AorUqAvaP via @cnbcmakeit
1092,CNBC,2016-09-07 22:59:09+00:00,Starbucks’ Howard Schultz on why he endorsed Clinton for president https://t.co/KPjUKtCwqj via @madmoneyoncnbc
1093,CNBC,2016-09-06 18:51:57+00:00,"Starbucks rolls out New York bagel balls at more than 7,000 locations https://t.co/rF94nnPjsP"
1094,CNBC,2016-09-03 12:48:29+00:00,"Starbucks' Pumpkin Spice Latte is back, and it brought along a new friend https://t.co/zimpByb8MD"
1095,CNBC,2016-09-02 04:00:36+00:00,"Starbucks' Pumpkin Spice Latte is back, and it brought along a new friend https://t.co/0FpSjUXcWw"
1096,CNBC,2016-09-01 20:38:16+00:00,"Starbucks' Pumpkin Spice Latte is back, and it brought along a new friend https://t.co/vWqi9J853W"
1097,CNBC,2016-09-01 13:36:29+00:00,"Starbucks' Pumpkin Spice Latte is back, and it brought along a new friend https://t.co/D9Pf9eX5Gz"
1098,CNBC,2016-08-11 20:00:00+00:00,Starbucks' almond milk may be a win-lose combo for the coffee chain https://t.co/J49tnlTMEQ
1099,CNBC,2016-08-02 20:14:10+00:00,Starbucks recalls millions of stainless steel straws https://t.co/Q23JLRbtQM
1100,CNBC,2016-08-02 19:49:16+00:00,Starbucks recalls millions of stainless steel straws https://t.co/otb6wtY6Kw https://t.co/iz8WETqBTm
1101,CNBC,2016-07-27 20:05:02+00:00,Starbucks packages up a trendy beverage so customers can make their own https://t.co/IqLi98W1XM
1102,CNBC,2016-07-26 16:19:44+00:00,Starbucks Cold Brew drinks can now be prepared at home https://t.co/AGUj98cdGx
1103,CNBC,2016-07-26 12:38:58+00:00,Starbucks to rally 19% on faster sales growth: Goldman Sachs https://t.co/VHaNqoeSHZ
1104,CNBC,2016-07-26 11:33:33+00:00,Starbucks baristas are showing their style with a new dress code https://t.co/VHPJoA2JJa
1105,CNBC,2016-07-22 15:19:01+00:00,"Starbucks' Schultz: Social, political turmoil is putting pressure on consumer https://t.co/tw8wd2mMsd"
1106,CNBC,2016-07-22 11:00:21+00:00,Starbucks shares drop after same-store sales around the world miss estimates https://t.co/VgKoyh0TFG
1107,CNBC,2016-07-21 20:29:04+00:00,"Starbucks drops 4% after revenue, same-store sales miss https://t.co/2ZEWyWikJp"
1108,CNBC,2016-07-21 19:52:07+00:00,Starbucks set to serve up its fiscal third-quarter earnings https://t.co/Du2TulqyBM
1109,CNBC,2016-07-18 17:30:22+00:00,New menu for Starbucks workers: A range of health insurance options this fall https://t.co/BDifo2fGPG
1110,CNBC,2016-07-14 20:20:22+00:00,Starbucks bringing fresh-baked goods to select stores https://t.co/XdOKXfyKBi
1111,CNBC,2016-07-11 16:48:50+00:00,Starbucks to raise wages for US workers in October https://t.co/Ni7hXwRLCS
1112,CNBC,2016-07-07 15:17:43+00:00,Starbucks to raise prices by up to 30-cents https://t.co/vqZ44txudj
1113,CNBC,2016-07-06 12:52:43+00:00,Starbucks to raise prices by up to 30-cents https://t.co/Jdsae3w6o7
1114,CNBC,2016-07-05 22:29:13+00:00,"After-hours buzz: Qorvo, Comcast, Starbucks &amp; more https://t.co/u9VKhdRxNl"
1115,CNBC,2016-07-05 19:20:57+00:00,Starbucks accidentally gave a sneak peak at next week's price hike https://t.co/S7lMvm3ngz
1116,CNBC,2016-07-05 17:01:20+00:00,Starbucks accidentally gave a sneak peak at next week's price hike https://t.co/xMmjQZFbEV
1117,CNBC,2016-06-01 02:30:11+00:00,Starbucks wants to infuse your coffee with nitrogen https://t.co/lt7c61HUUi
1118,CNBC,2016-05-31 15:38:13+00:00,Starbucks wants to infuse your coffee with nitrogen https://t.co/CMmLQ1aVbf
1119,CNBC,2016-05-26 22:30:38+00:00,Starbucks' China business could surpass US: CEO Schultz https://t.co/LFobhmfQYA
1120,CNBC,2016-05-02 20:54:07+00:00,Starbucks sued for allegedly filling cold drinks with too much ice https://t.co/17fx8gdaQ8
1121,CNBC,2016-05-02 19:48:12+00:00,Starbucks sued for allegedly filling cold drinks with too much ice https://t.co/1hbVxRac3q
1122,CNBC,2016-04-12 16:24:47+00:00,".@JimCramer: Starbucks downgrade OK, but… https://t.co/jkub7KouiV $SBUX https://t.co/nvs6TwhaAn"
1123,CNBC,2016-04-06 23:30:23+00:00,.@Starbucks knows how you like your coffee https://t.co/PNpfhWD40j https://t.co/fCsAr5sV0H
1124,CNBC,2016-04-05 19:15:11+00:00,".@Starbucks  is bringing back Caramel Cocoa Cluster Frappuccino. #NationalCaramelDay lovers, rejoice! https://t.co/rDvBTBOvoR"
1125,CNBC,2016-04-02 16:01:42+00:00,One former Starbucks exec's big gamble on pizza https://t.co/3uB1FNtOCQ https://t.co/PIoWN6H0UJ
1126,CNBC,2016-04-01 18:01:01+00:00,One former Starbucks exec's big gamble on #pizza https://t.co/3uB1FNtOCQ
1127,CNBC,2016-03-24 00:45:12+00:00,"Starbucks to announce Nespresso pod deal, new perks https://t.co/ZKrhFQHjm1 https://t.co/sBPAZc27NU"
1128,CNBC,2016-03-16 21:00:53+00:00,Starbucks celebrates spring with this new drink https://t.co/Em7EsCNPly $SBUX https://t.co/GUPDhpW613
1129,CNBC,2016-03-08 16:15:16+00:00,Starbucks item recalled for listeria https://t.co/z8koqj3TYT $SBUX https://t.co/KGmgJ3rSjV
1130,CNBC,2016-02-29 13:15:05+00:00,Coffee giant Starbucks is finally ready to take its Americanized version of Italian coffees to Italy https://t.co/ofAekOCn4y $SBUX
1131,CNBC,2016-02-24 15:30:43+00:00,Starbucks just made a major legal precedent for alcohol...in Utah https://t.co/q4UUIHUrk2 https://t.co/pyB0MC1jPK
1132,CNBC,2016-02-22 16:00:56+00:00,Starbucks announced changes to its loyalty program. Here's what it means for you:  https://t.co/T64pylGNDH https://t.co/rsn7rxH4eG
1133,CNBC,2016-02-21 02:30:31+00:00,Starbucks responds to ‘shocking’ sugar accusation https://t.co/QvjkkUfp0t https://t.co/ExzgN56wLS
1134,CNBC,2016-02-20 06:00:29+00:00,Starbucks responds to ‘shocking’ sugar accusation https://t.co/QvjkkUfp0t https://t.co/IZdeu2BtsJ
1135,CNBC,2016-02-18 21:15:22+00:00,Harry Potter fans are freaking out over a new Starbucks drink that tastes like butterbeer https://t.co/mLorcSmOWJ https://t.co/65bwf2VFn2
1136,CNBC,2016-02-17 22:01:13+00:00,How much sugar is in your coffee? Starbucks responds to ‘shocking’ sugar accusation https://t.co/QvjkkUfp0t $SBUX https://t.co/7I0Iu2MPMa
1137,CNBC,2016-02-17 16:00:54+00:00,Starbucks responds to ‘shocking’ sugar accusation https://t.co/QvjkkUfp0t https://t.co/eCZpSKnJ1S
1138,CNBC,2016-02-09 18:02:27+00:00,Starbucks has launched its molten chocolate beverage trio in celebration of Valentine's Day. https://t.co/mmdhZeVGvr https://t.co/8cU17vTb0A
1139,CNBC,2016-02-09 02:00:21+00:00,Starbucks unveils Valentine's-themed beverages: https://t.co/mmdhZeVGvr https://t.co/bqD5BbEjqz
1140,CNBC,2016-01-25 02:30:35+00:00,Cramer: What Starbucks earnings say about China https://t.co/7bzrtAfpXe https://t.co/uIJ1X6vltc
1141,CNBC,2016-01-23 03:45:10+00:00,Cramer: What Starbucks earnings say about China https://t.co/7bzrtAfpXe https://t.co/vJ2bKOmhmy
1142,CNBC,2016-01-21 22:00:23+00:00,Starbucks earnings beat but shares fall https://t.co/776HCsJG9V https://t.co/QqykLwqg2G
1143,CNBC,2016-01-12 12:45:15+00:00,Starbucks to open 500 new stores in China in 2016 https://t.co/WcFMxVTBUp https://t.co/1i6VpJoJkw
1144,CNBC,2016-01-06 20:07:09+00:00,"Starbucks confrontation goes viral, barista fired $SBUX
https://t.co/hdtcjuMy9z"
1145,CNBC,2015-12-30 14:01:59+00:00,The most popular Starbucks holiday drinks are... https://t.co/kyUjtpLFnA https://t.co/KU7Bh1mzOD
1146,CNBC,2015-11-13 21:45:42+00:00,Brands are cashing in on Starbucks red cup controversy https://t.co/COqzXcJ2kp https://t.co/fucY5rL6FN
1147,CNBC,2015-11-13 18:15:21+00:00,The real winner in Starbucks red-cup controversy https://t.co/kkDzjkf0QH https://t.co/e6pBzGQWEj
1148,CNBC,2015-11-13 02:30:44+00:00,Dunkin' says new holiday cups not a Starbucks slam » https://t.co/COqzXcJ2kp #ItsJustaCup https://t.co/GSrQAY0nMm
1149,CNBC,2015-11-12 18:30:43+00:00,"No, Dunkin' Donuts is not trying to shame Starbucks. https://t.co/dOATLNMV2U https://t.co/89u7bqq4J9"
1150,CNBC,2015-11-10 16:15:17+00:00,"""Maybe we should boycott Starbucks..."" Trump weighs in on the red cup controversy:  https://t.co/COqzXcJ2kp https://t.co/9lhp8611If"
1151,CNBC,2015-11-10 01:45:13+00:00,This is why people are mad about Starbucks' new cups. https://t.co/COqzXcJ2kp https://t.co/LZbMv8dWLO
1152,CNBC,2015-10-30 23:30:39+00:00,"Starbucks is opening a store a day in China, CEO Howard Schultz says: https://t.co/2QPa5Zs6tD https://t.co/ymt4RU6gyl"
1153,CNBC,2015-10-30 02:45:17+00:00,Why Starbucks fell after the bell » https://t.co/qu6lhxu365 https://t.co/mk1kwMGKFL
1154,CNBC,2015-10-26 17:20:09+00:00,There's a new Halloween treat scaring up the menu at Starbucks » https://t.co/B8RORfZghe https://t.co/jmji1SDKpX
1155,CNBC,2015-10-21 00:00:19+00:00,Meet Starbucks' new 'Beast Mode' Frappuccino » https://t.co/wwyEQaEdut https://t.co/dpQzt5ZjhJ
1156,CNBC,2015-10-15 20:10:17+00:00,Starbucks may be opening new stores here... http://t.co/zq4mulSfSK http://t.co/SFG8qdocU2
1157,CNBC,2015-10-13 14:40:16+00:00,Starbucks has launched its much-anticipated delivery service pilot program: http://t.co/qTlLNE2gQR http://t.co/fj7a2VTSzJ
1158,CNBC,2015-09-25 18:30:40+00:00,Starbucks to offer major new incentive to some staff: http://t.co/iUH3sbjPG2 http://t.co/v1jy5M04I1
1159,CNBC,2015-09-23 17:50:13+00:00,Starbucks falls short after pledging better labor practices: http://t.co/gdneXHBL1x http://t.co/4nvzWnPJB1
1160,CNBC,2015-09-22 12:30:28+00:00,"If you hate standing in line for your Starbucks fix, there's an app for that: http://t.co/ulqWQqxpY2 http://t.co/oe0gryDi4P"
1161,CNBC,2015-09-10 14:47:28+00:00,"Get ready for this. @Starbucks' Pumpkin Spice Latte now has real pumpkin puree in it. @JaneWells takes a sip!
https://t.co/OSBHACKqHv"
1162,CNBC,2015-08-25 13:20:11+00:00,Starbucks CEO: Empathize with worried investors http://t.co/KxVrDxYhNp http://t.co/euLSsLWxC4
1163,CNBC,2015-08-23 22:30:55+00:00,Starbucks is hoping these additions will convince you to spend your evenings there »   http://t.co/wxtovJJyyH http://t.co/kuxcODYvzh
1164,CNBC,2015-08-19 06:30:49+00:00,Starbucks is hoping these additions will convince you to spend your evenings there »  http://t.co/wxtovJJyyH http://t.co/kuxcODYvzh
1165,CNBC,2015-08-18 03:20:41+00:00,Starbucks is hoping these additions will convince you to spend your evenings there » http://t.co/wxtovJJyyH http://t.co/kuxcODYvzh
1166,CNBC,2015-08-17 18:31:42+00:00,One of Starbucks' most popular drinks is changing » http://t.co/WdbMkuRRZj http://t.co/H4ZvLjbVlB
1167,CNBC,2015-08-17 14:30:09+00:00,Starbucks is hoping these additions will convince you to spend your evenings there: http://t.co/wxtovK19qf http://t.co/kuxcODYvzh
1168,CNBC,2015-08-14 23:31:10+00:00,".@Starbucks CEO spoke to @JimCramer on job creation, and why business leaders need to step up http://t.co/yOTkUcE5Mc http://t.co/FigkT3SoGh"
1169,CNBC,2015-08-07 00:42:54+00:00,"America deserves better candidates, says Starbucks CEO http://t.co/mF2vuFkKht • #GOPDebate http://t.co/pY5M4W8CMd"
1170,CNBC,2015-08-01 04:01:34+00:00,"Former NBA star working at Starbucks after spending $100,000,000 in earnings » http://t.co/VC7NCDFdtr http://t.co/n2Xu7JFxuH"
1171,CNBC,2015-07-31 16:50:03+00:00,Former NBA star working at Starbucks after spending $100 MILLION in earnings: http://t.co/BBHYj5Pu8P http://t.co/nrwXKMguYl
1172,CNBC,2015-07-31 03:20:29+00:00,Former NBA star working at Starbucks after spending $100M in earnings: http://t.co/VC7NCDFdtr http://t.co/n2Xu7JFxuH
1173,CNBC,2015-07-30 15:50:04+00:00,An ex-NBA star is now working at Starbucks after spending $100M in earnings: http://t.co/VC7NCDnC4R http://t.co/EFfHAQY8ik
1174,CNBC,2015-07-30 06:31:11+00:00,Ex-NBA center Vin Baker is now working at ... Starbucks? » http://t.co/zosGfCt7GV http://t.co/M5NGBMQMCY
1175,CNBC,2015-07-30 00:01:57+00:00,"Former NBA star working at Starbucks after spending $100 MILLION in earnings, report says: http://t.co/VC7NCDFdtr http://t.co/n2Xu7JFxuH"
1176,CNBC,2015-07-29 13:59:19+00:00,Former NBA star working at Starbucks after spending $100M in earnings: http://t.co/VC7NCDFdtr http://t.co/n2Xu7JFxuH
1177,CNBC,2015-07-26 22:31:01+00:00,Starbucks' new plan to combat inequality » http://t.co/zKgok0CloD http://t.co/uVr1PK98kb
1178,CNBC,2015-07-25 00:50:25+00:00,Starbucks says it just had its best quarter in history: http://t.co/gW8Qmh19aM http://t.co/bYyiO8fEY4
1179,CNBC,2015-07-24 16:50:50+00:00,"Starbucks wants to take over the world, Jim Cramer says » http://t.co/4AJiFBr3BQ http://t.co/djEgd807X5"
1180,CNBC,2015-07-23 18:20:45+00:00,Starbucks says people will soon be able earn rewards points by using Lyft » http://t.co/yBAB7JzCqU http://t.co/ITuXqy6wVF
1181,CNBC,2015-07-23 06:31:04+00:00,Never accuse Starbucks' CEO of being afraid to take on tough issues: http://t.co/x8EGY5W4Ge http://t.co/Ldwu9UAcKn
1182,CNBC,2015-07-20 05:01:24+00:00,Starbucks' new plan to combat inequality: http://t.co/zKgok0CloD http://t.co/uVr1PK98kb
1183,CNBC,2015-07-17 04:30:49+00:00,Starbucks' new plan to combat inequality: http://t.co/zKgok0CloD http://t.co/sGFWbYshEW
1184,CNBC,2015-07-14 18:32:03+00:00,Starbucks will open its first stores in sub-Saharan Africa next year » http://t.co/GIU9xHmWPT http://t.co/djhKyg12kL
1185,CNBC,2015-07-13 13:45:10+00:00,"Execs from some of the biggest companies (led by Starbucks) commits to hiring 100,000 youth • http://t.co/K9OfmeyF1z http://t.co/rfaQ8AJONV"
1186,CNBC,2015-07-11 09:02:15+00:00,Starbucks' latest announcement is a game changer » http://t.co/IwfYKPd67a http://t.co/UJAEBJLdK0
1187,CNBC,2015-07-08 02:31:03+00:00,"For fans of cold brew coffee, Starbucks' latest announcement is a game changer: http://t.co/IwfYKPd67a http://t.co/UJAEBJLdK0"
1188,CNBC,2015-07-07 16:20:03+00:00,"For fans of cold brew coffee, Starbucks' latest announcement is a game changer: http://t.co/IwfYKPuGYI http://t.co/UJAEBJLdK0"
1189,CNBC,2015-07-07 06:01:29+00:00,Starbucks says it's hiking prices again starting Tuesday: http://t.co/4OFD72dYDC http://t.co/2CTaIAyXgJ
1190,CNBC,2015-07-07 00:10:38+00:00,Starbucks is raising prices again: http://t.co/xZnTCo2ouN http://t.co/HPXWBXTU21
1191,CNBC,2015-07-06 17:55:06+00:00,Starbucks says it's hiking prices again starting Tuesday » http://t.co/xZnTCo2ouN http://t.co/g2ZwhM2Cfb
1192,CNBC,2015-06-18 03:30:47+00:00,Starbucks to close all 23 of its La Boulange locations: http://t.co/g0ImGYzOI4 http://t.co/eMWrT5rnCa
1193,CNBC,2015-05-18 23:01:41+00:00,"The @Spotify deal is just the first of many to come, @Starbucks CEO tells @JimCramer: http://t.co/kp9YRPSTEo
https://t.co/5Dt384FkfQ"
1194,CNBC,2015-05-16 12:00:41+00:00,"With its new drink, Starbucks is banking on you indulging ... but just a little » http://t.co/xfzrHYdgbB http://t.co/LX5HFuRvta"
1195,CNBC,2015-05-14 03:20:14+00:00,"With its new drink, Starbucks is banking on you indulging ... but just a little » http://t.co/xfzrHYdgbB http://t.co/LX5HFuRvta"
1196,CNBC,2015-05-13 18:01:56+00:00,Hackers are targeting the Starbucks mobile payment app and gift cards » http://t.co/pfvgAc55lX http://t.co/vOKnJgaqz1
1197,CNBC,2015-05-12 23:10:21+00:00,"With its new drink, Starbucks is banking on you indulging ... but just a little » http://t.co/xfzrHYdgbB http://t.co/LX5HFuRvta"
1198,CNBC,2015-05-12 19:15:11+00:00,"Starbucks's app is now a target for hackers.
https://t.co/PDa0plSdE6"
1199,CNBC,2015-05-12 01:20:22+00:00,"With its new drink, Starbucks is banking on you indulging ... but just a little » http://t.co/xfzrHXVEN1 http://t.co/LX5HFuRvta"
1200,CNBC,2015-05-11 17:55:40+00:00,"Starbucks is introducing a size that is smaller than small.
https://t.co/nxMKZa8ZIN"
1201,CNBC,2015-05-11 15:00:18+00:00,"With its new drink, Starbucks is banking on you indulging ... but just a little » http://t.co/xfzrHXVEN1 http://t.co/LX5HFuRvta"
1202,CNBC,2015-05-09 12:30:25+00:00,"McDonald's, Chipotle &amp; Starbucks are banking on this man » http://t.co/QVisx8fIez http://t.co/Pyc012S5sY"
1203,CNBC,2015-05-08 21:20:23+00:00,Starbucks said it would stop sourcing water for its Ethos Water brand in California » http://t.co/clNVeosMri http://t.co/pMYNhXi3Kt
1204,CNBC,2015-05-07 00:50:14+00:00,"McDonald's, Chipotle &amp; Starbucks are banking on this man » http://t.co/QVisx8fIez http://t.co/Pyc012S5sY"
1205,CNBC,2015-05-06 03:10:23+00:00,"McDonald's, Chipotle &amp; Starbucks are banking on this man » http://t.co/QVisx8fIez http://t.co/Pyc012S5sY"
1206,CNBC,2015-05-04 20:54:26+00:00,"McDonald's, Chipotle &amp; Starbucks are banking on this man » http://t.co/QVisx8xj67 http://t.co/KsjCstsmt3"
1207,CNBC,2015-05-03 14:30:40+00:00,Starbucks opens first express store...guess where? http://t.co/BX56TqsBDU http://t.co/A6qzO13y65
1208,CNBC,2015-05-02 04:30:22+00:00,Starbucks opens first express store...guess where? http://t.co/BX56TqsBDU http://t.co/A6qzO13y65
1209,CNBC,2015-05-01 02:50:04+00:00,Starbucks opens first express store...guess where? http://t.co/BX56TqsBDU http://t.co/A6qzO13y65
1210,CNBC,2015-04-30 18:38:54+00:00,Starbucks opens first express store...guess where? http://t.co/BX56TqsBDU http://t.co/A6qzO13y65
1211,CNBC,2015-04-27 15:50:37+00:00,"Investors shouldn't sell their Starbucks shares because of the recent outage, Jim Cramer says: http://t.co/8XYvnTLhJK http://t.co/JV4geO3tAP"
1212,CNBC,2015-04-27 07:40:16+00:00,Starbucks is missing out on a big opportunity » http://t.co/R1MV0EEbBI (op-ed) http://t.co/5C3Fb5FCI6
1213,CNBC,2015-04-25 01:36:27+00:00,ICYMI: Starbucks stores are giving away free drinks as the company works to fix a nationwide payment system outage. http://t.co/6hTe8QUDr6
1214,CNBC,2015-04-09 07:30:10+00:00,Starbucks will spend at least $250 million by 2025 to send its workers to college: http://t.co/cfFqD800QW http://t.co/1921KUlSuE
1215,CNBC,2015-04-08 05:45:21+00:00,Starbucks expands college tuition perk for workers » http://t.co/L1npNkkldB http://t.co/kMBwEFS0Oj
1216,CNBC,2015-04-07 13:56:07+00:00,Starbucks will spend at least $250 million by 2025 to send its workers to college: http://t.co/cfFqD800QW http://t.co/1921KUlSuE
1217,CNBC,2015-04-03 01:00:28+00:00,Starbucks is now offering a different kind of product » http://t.co/cbd0G6FAqN http://t.co/hGBS82LSVg
1218,CNBC,2015-04-02 15:01:26+00:00,Starbucks is now offering a different kind of product » http://t.co/cbd0G6FAqN http://t.co/hGBS82LSVg
1219,CNBC,2015-04-01 06:15:24+00:00,Starbucks debuts new smoothies...kale optional: http://t.co/cbd0G6FAqN http://t.co/mYF6GBnPBk
1220,CNBC,2015-03-26 17:40:39+00:00,Starbucks who? The other java king named Schultz » http://t.co/klFUMIim9T (op-ed) http://t.co/IlBddFgubr
1221,CNBC,2015-03-24 04:20:13+00:00,"Starbucks ends 'Race Together' campaign, but the company's effort ""is far from over"" » http://t.co/m7q3Sp7F4N http://t.co/0PKUrARkoT"
1222,CNBC,2015-03-22 20:30:29+00:00,Starbucks is rolling out another way to get customers to spend a bit more for coffee » http://t.co/7XHhYuTEOh http://t.co/cs3gtMQ78D
